id,title
YNTD0S,Northern California man wonders if meteorite destroyed his house
YNX5JC,Used coffin traded in at pawnshop as economy worsens
YO6ZC8,Twitter now asks some fired workers to please come back
YNI4LI,Yorkshire bus company receives fine from council - after one of their buses is caught in a bus lane
YNO5W1,"Please don't lick this psychedelic toad, National Park Service warns"
YNX5UL,Thieves crash into each other after stealing from Springfield clothing store
YO33S2,Used coffin traded in to borrow money at pawnshop as economy worsens
YNLR0M,West Ham star Kurt Zouma expresses 'great remorse' for kicking cat
YO4X0X,South Korea miners survive nine days underground on coffee
YNKWF2,Two youths in Kollam booked for taking bath while riding bike
YNQQ73,Tesla(NASDAQ: TSLA) Still Sells More Luxury Cars than any Other Brand in the US.
YMWU7O,"Jeff Bezos’ Housekeepers got UTIs From Lack of Bathroom Access, Says Lawsuit"
YN9O3Y,A Deputy Sold the Guns Used in the Roxborough High School Shooting to an Informant
YMY6HA,Herschel Walker says he has solutions to major issues but won't share them
YNATHW,Lawyer who fought helmet laws killed in motorcycle crash while not wearing one
YOA5DU,"Founder of Oculus, Palmer Luckey, Creates VR Headset That Kills The User To Commemorate Sword Art Online Launch Day"
YMNI5W,Joe Rogan admits schools don’t have litter boxes for kids who ‘identify’ as furries
YMXO0I,El Paso High School students may have to retake SATs after tests fly out of UPS truck
YNAIXI,Four teenagers killed doing ‘TikTok challenge’ before horror car crash
YMNZDQ,Ugandan women drugs and robs men who suck her laced nipples.
YMG3OX,"Montreal police handcuff innocent Black man, have no key to release him"
YMZCBQ,Man dressed as pikachu ran from police on a modified mower pulling a trailer
YMWNSG,Oregon mayor accused of firing gun at vehicle containing children in road rage incident
YN9CHL,Porsche wants to sell you a $12k rusty tailpipe soundbar
YN2WPU,"Don’t inhale nasal tanning spray, doctors warn"
YMNT7M,"Tiny school's wheat crop harvest 'better than a cake sale', set to raise $50k"
YM0289,"MTA launches ""Subway Bingo"" game, but riders say they want safety, not games"
YN2PF5,"Indiana man dressed as Pikachu ran from police on lawn mower, cops say"
YLYCT5,"National Park Service says, don’t lick the poison toad"
YMRFME,Paintballs to be shot at Dutch wolves in bid to make them less tame
YMYTOL,"Don’t lick the poison toad, National Park Service warns"
YMDBMP,Driver ‘seriously injured’ after being run over three times by own car
YMVS86,"Sacramento debuts their new ""Kings Victory Beam"". A purple beam, powered by four lasers, will be lit for every home and away victory, ""to increase fan engagement and further deepen its connection with the city."""
YM2XN9,"Poisonous Cobra dies after being bitten by Indian boy, 8"
YMNVRH,Woman Thanks Man for Not Staring at Her When She Was Squatting at the Gym
YMTYWV,Some law enforcement officials are policing elections
YMT6OZ,Jet2 flight from Gran Canaria to Manchester diverted so passengers could go to the toilet
YM8CWB,The Air Force Said Its Aircraft Did Not Draw A Dick And Balls In The Sky On Purpose
YMK1TM,Nurse charged with abuse for allegedly cutting dying man's foot off without permission
YM32BT,Leeds bus fined for being in bus lane to get to bus stop
YMBEBW,2 Denver firefighters declared a living woman dead without assessing her
YLMA11,"Woman calls 911 over barbecue being too pink, and therefore not fully cooked."
YMFCII,Woman in Switzerland run over three times... by her own car
YMD3WQ,Missouri 'Venom Fest' Ends Early After Cobra Disappears
YM4BFW,Majority of Americans favour new stimulus checks to combat inflation
YMDQE5,Want to live in a van down by the river? Ford has a new vehicle for that
YLMD6T,Author reminds Americans that Samuel Adams was a revolutionary before he was a beer
YL3E62,Milwaukee police switching to new guns after three cops accidently shoot themselves
YLXVWG,Girl plays music to lonely animals to beat stage fright
YM744O,Customer calls police over ‘pink pork’ at historic Raleigh BBQ joint
YL54UI,A Church Built a Massive Baby Jesus Statue That Looks Exactly Like Phil Collins
YM009H,"Toxic smog turns India's capital ""into a gas chamber"""
YLZV1E,Bed in shower room advertised for 1.080 francs a month in Canton Zurich
YM9DDL,It takes a lotto win for this 93 yr old man to pay off his house
YMY1E7,House of the Dragon star Emma D’Arcy makes GQ’s Men of the Year list
YLS3UQ,"Wallaby seen running free in Southeast Michigan, police want to identify owner"
YLIT2U,Law enforcement ratchets up presence in voting process as some sheriffs push election conspiracy theories
YL7CQ3,Paintballs to be shot at Dutch wolves in bid to make them less tame
YMKN9O,"Richard Branson ‘pontificating from a distant mountaintop’, his reasons to decline debate don’t hold water: MHA"
YM2ZN3,Hedge fund manager seeks butler to manage family gadgets
YLB9DZ,"Iran’s Khamenei Feels Lonely, Isolated, Says Pundit"
YLU49G,Luxembourg's strongest man lifts Microsoft founder with his teeth
YLHL20,National Carp Control Plan report calls for more research before unleashing herpes
YLIKKY,Tennessee could drop mandatory teacher’s test amid shortage
YLN7XF,"Armed Carjackers Steal St. Louis Deputy's Gun, Phone"
YLEKXC,"Bumblebees play with balls just for fun, study finds"
YMT3KC,"Woman who looks like Jim Carrey says it's ""very hard"" to recreate his smile"
YL7ZQY,Georgia Police Arrests Willacoochee Chief of Police On Burglary Charge.
YLJLVO,Lamar Odom says Lakers fan gifted him the NBA championship rings he pawned
YLJGIA,Irish Rail worker sacked after he was jailed for crashing car into cyclists while drunk wins unfair dismissal case
YLIHSZ,Richard Branson will stop ‘turning girls upside down’ on Virgin planes
YKET2A,Pennsylvania by the sea: Mehmet Oz implies state has Atlantic coastline
YLOHEC,Loch Ness Monster teachings unacceptable in Sask. independent schools: NDP
YKGKTE,Musk boosts surge in misinformation about Pelosi attack
YLJ605,"Who is Dowen Jones, Rufus mayor accused of firing multiple shots at a car with children inside?"
YMEFDJ,Ottawa Senators officially for sale (the team)
YME1G8,Ottawa Senators officially for sale
YK1SEA,Man who wore Hitler costume for Halloween fired from his job
YL8KJY,Paso Robles Schools are Not Placing Litter Boxes in Restrooms to Accommodate Furries
YLCFP3,Chinese Tesla competitor unveils plans for flying car
YL6YYD,LGBT football fans told to be respectful at Qatar World Cup
YL9M5L,'Harry Potter' fans warned to stop leaving socks at Dobby's grave on a beach in Wales
YL7EFG,Warning issued over TikTok trend that turns candles into heaters
YKN9JQ,Oregon mayor arrested in connection to shooting and road rage incident
YL6XSQ,Want to live in a van down by the river? Ford has a new vehicle for that
YL5Q1I,Pete Rose Scheduled to Place First Wager at Hard Rock Cincinnati Sportsbook
YL4TLO,LGBT football fans told to be respectful at Qatar World Cup
YKPJI1,Denver firefighters suspended for getting woman pronounced dead even though she was alive
YKL979,Head of catalytic converter theft ring had a necklace made in the shape of the car part; posted it on social media
YL5011,'BagGate' cheating scandal rocks professional cornhole world
YKTERX,Ballot That Doesn’t Mention Abortion Actually About Abortion
YLCYAI,Richard Branson will stop ‘turning girls upside down’ on Virgin planes
YKSVCT,Heidi Klum unrecognizable in elaborate giant worm costume at her New York City Halloween bash
YKOZR4,'Pure evil' black bird named Derek terrorising Yorkshire village
YKP0OC,Baby cow and owner still missing after sleeping in container with alligator
YK9CXI,Cobra dies of child bite in Chhattisgarh!
YKNUSU,Italian researchers find new recipe to extend life of fresh pasta by a month
YJFOC4,"People return to offices, productivity plunges"
YKKHCN,Walker hits back at Obama: ‘Put my resume against his resume’
YKITNG,Man Pretending to Be Student Lived on Stanford Campus
YLUBJ4,World's Oldest Mother Gives Birth to Twins at 74
YLIH27,Will a Crossbow application harm my neighbour's fruit trees? Ask an expert
YL9BHL,I turned my fallopian tubes into a necklace
YKV2Q6,The first Jumanji theme park will open in the UK soon!
YKMCAW,Woman dies after being hit by train in Surprise
